id	sentence	label
1135929009957683202	mtn u sent me a message and deducted shs of my airtime supposedly for making a call when i havent called anyone why can u pse refund my credit please 	None
1135930801982451712	but mtn with all my airtime i cant make calls or send texts triumph 	None
1135936745982308352	airtel your service of sending mobile money to mtn number is too slow 	None
1135938975305293824	atimcharlotte mtn it just happened to me too today no mbs no airtime and yet you sent me a messages your thieves you guys 	Negative
1135947214377967617	these hairy bumlines of mtn its days now they stole my mobile money plus airtime and paka money 	Negative
1135951862287491072	hello mtn i loaded data for ugx mbs and money was chopped from my mobile money but no data delivered now i loaded again what do i do with money chopped and no data 	None
1135951993694851072	mtn atimcharlotte mine was my pakapakayou guys deducted the money from my mobile account but up to now i havent received the minutes 	None
1135962717284687873	mtn internet bundles are a scam pout 	None
1135967638180519937	mtn what is wrong with your internet the quality keeps worsening it keeps hiccuping n this is irritating whenever am around kireka no matter where i sit in kireka internet is poor 	None
1136011879279726594	here wondering what mtn think they are you failed to activate for me my paka you chopped my money without any service in return i called you told me to wait but nothing instead its my hard earned money better bring it back you guys are real fraudmtnug 	None
1136013077034557441	mtn continues to steal ugandans its the nd time money is deducted from my mobile money without the minutes being loaded is it too much excitement of welcoming the ceo back or thought i was the only one but then i noticed it happened to many others 	None
1136125693237112832	mtn good morning mtn its been more than hrs since reporting this issue and my line is still barred from payingsending money to airtel is this still a general problem whats the update from your technical team 	None
1136126560258396160	good day mtnugcare yesterday i failed to get my data bundle activated even after you deducted my money till now i have seen nothing how can you help me mtn 	None
1136205415778312192	mtn yesterday you deducted my mobile money twice with out giving me my pajamas services until i called and you told of a problem with the service why didnt you communicate earlier please sort me thanks 	None
1136229832432463872	mtn mtn is that what you offer now your employees abuse customers when they have a complaint 	None
1136230052763504641	mtn so disappointed at your employees 	None
1136233881802280961	mtn well thank you 	Positive
1136251818835623936	mtn my phone number was fully registered with my national id and also confirmed with my nin number but it was disconnected can you help or i should forget about it 	None
1136255759904321536	mtn guys cmon i need paka whats the deal with the app 	None
1136282846279229440	mtn app is the most useless thing on phone right now time to delete 	None
1136287364572225536	mtn i buy gb per month and your telling me that in one week i have used of my data smirk so i expect tomorrow to get a msg that i have used up my monthly data 	None
1136290144124846080	mtn yes i see that but im worried i might wake up without data 	None
1136306693296611328	mtn mtnugcare pls help me clarify on the pulse bundles system coz it has clearly failed to loadthx 	None
1136327124577607680	what could be the problem with this number that it cant receive incoming calls mtn 	None
1136350886114914304	hello donatngz your callertune is annoying to make things worse you take long to pick is there a way one can request mtn for cancellation on someones behalf 	None
1136361889859080192	mtn you took away the gags wednesday now you have taken away your network how i wish you take away your sim cards mbwa mwe hey africell wheres the nearest place around kids so i can get your sim 	None
1136368563894333440	but mtn you people are so disorganized your network is always on and off 	None
1136445650848178176	mtn superb twitter customer care kudos 	None
1136499297564987393	dear mtn these ussds are killing us whens the mobile app going to back online cc mtnugcare 	None
1136501486953914368	njoyie mtn mtn is thief today is thursday but where is my pakapaka two times money shit gb two times is gb fuck 	None
1136501875690364928	my mobile money function on the mtn app doesnt work anymore is it just me thinking 	None
1136583236375777280	mtn my network currently says no service after i received a notification that iphone not activated and contact your carrier what is the problem 	None
1136603051165458437	mtn what is wrong with internet 	None
1136620279021678593	mtn fuck your ceo where is my pakapaka money thief 	Negative
1136626774593302528	mtn your mobile money app has been unavailable for two weeks when will it be fixed 	None
1136664834458734592	mtn did the mtn app die with gaaga wednesday or you guys are just punishing us the customers 	None
1136682606513274880	mtn how do u double bundles when ur not giving us the current ones even after deducting our money i doubt that 	None
1136692633735184384	mtn what the hell is wrong with you how do i buy mbs and they just disappear like ghosts pissed off just wefuge 	None
1136713500682784770	mtn why have you debited my account twice without activating my paka bundles 	None
1136715791745900549	mtn thank you for such a better move again to satisfying mtn customers 	Positive
1136716049309741056	mtn mtn uganda the most bogus telecom company hv ever seen as am talking now its weeks now i cant use there app either buy mbs by dialing the thou i submitted my issue amp told to wait for hours but up now it was not dan 	Negative
1136728483248443392	mtn before u decide to double my voice bundlecan u refund my datamobile money that i subscribed for and didnt receive 	None
1136879719754993664	mtn i am failing to load data and the number is saying its incorrect 	None
1136886746208190464	mtn do you have some upgrades yr working upon or cse my network isnt sexy at all 	None
1136886796602761216	mtn its funny how you guys dont notify me that my number is blocked when i deposit money but tell me how i cant access it on withdrawal aint this thuggery 	None
1136966849151868929	mtn i want to spend my loyalty points on internet bundles what i dont understand is why youre limiting me to mbs what kind of disrespect is that 	None
1137017742253535233	mtn i cant thank you enough for this good internet connection 	None
1137045445140713472	kanyefelly u can finally come back home we now have mtn network all over the place 	None
1137046369645076480	mtn hello your internet speed in arua is sooo slow these days it used to be better once upon a time thinking can it get better oba i climb the mango tree neutralface 	None
1137054310548758528	mtn how do i fix this error fyi i pay ott so this is not due to vpn errors everywhere unfortunately both ussd and mymtnapp are affected any help 	None
1137064772749471744	airtel something is wrong with your data bundles they seem to get depleted faster than mtn even without use note that i blocked background data before performing my experiment 	None
1137075425186930689	mtn when are you putting g in my area pout this network is toooooo slow g is stupid when you have tasted g sob 	None
1137077536200904704	mtn called me this afternoon asking for feedback on their internet i told them its shitty around home so theyve decided to make it shittier rolleyes are you guys angry at me or something 	None
1137089791042961408	mtn thank you its much better 	Positive
1137215504274378753	give me one reason why i shd not delete the mtn app 	None
1137324480467013632	mtn i bought voice bundles on rd june and money was deducted from my mm account but didnt get the bundles mwagala tumale baloga to refund angry 	None
1137364464603410432	is it mine or mtn internet is sucking this evening expressionless i dont get it tooooo slow 	None
1137423162650574848	mtn am still here waiting to hear from you since that time you had issues with mypakapaka internet bundles neither was i notified nor did i get a refund as customer care said 	None
1137464156800671744	mtn mtnugcare could be it be am witchhunted the way my data is depleted is alarming i bought gb at pm but by pm it was done yet i didnt download or update anything just a few whatsapp text amp checking on twarr nga a text pops up i have used up my datandimunyivu pout 	None
1137470528686632961	mtn theres no way you can tell me that i used gb within two hours without downloading videos and you tell me its normal usage 	None
1137493059762085895	mtn why is the network so slow 	None
1137603387577552896	mtn mtn is thief today is sunday but where is my pakapaka two times money shit gb two times is gb fuck i will come your twitter everyday 	Negative
1137642710859431942	mtn someone needs to tell me where my mbs went in minutes when my data was switched off are you people crazy flushed you do this to me thrice a week pout you stink triumph 	None
1137644983199162368	now look mtn you cant be making our weekend worse than it seems whats wrong with mobile money 	None
1137650354429071360	mtnugcare mtn now my pple since last nite am getting sms alerts about data upgrades and you mentioning that the system will be downhati i rarely use the internet given by mtn how i wish you send me bundles to remind me that am your customer other than ruining my silent wknd 	None
1137654129373962241	mtn where is my shillings i can decide to tweet you every day until you pay it 	Negative
1137677280292085761	mtn when will you fix the mobile money app its been showing errors for almost weeks now 	None
1137749270541557761	mtn how about with existing bundles ive been having trouble connecting to the internet since pm on and off hope this reply even goes through phone number is 	None
1137978283205640192	eroquezan mtn it is mbu i cant access mobile money 	None
1137984830333947905	mtn do you come like thieves in the night to steal our mbz i had over mbz before i slept and woke up to zero heavyexclamationmark thinking 	None
1138048301847273472	thats the reason i like mtn they understand the trend and technology 	Positive
1138057215301115904	mtn how do you count your our data usage how can you tell me i have used of gb in days i dont youtube dont down load those big videos shared 	None
1138075418190405633	mtn your internet connection is must so sick these days and you just left with notifying us how we have used of our data after minutes i can now relate to airtel advert of yellow bananas 	None
1138090655446646784	mtn hello there what happened to the mymtn appmobile money its been eons since it last worked 	None
1138093232045383681	mtn u need to work on your internet network its getting worse everydayimagine switching off the network for many hrs upgrades on data but its still worse than beforeit is too slow i wonder why it shows g yet loads nothingdo we have to plead for the services we pay for 	None
1138100444994125824	ugequitybank hi all am not happy with ur services how can u block my account just because mtn and your credit section have failed to reconcile and yet money was deducted from my mm account do something about ur systems as this has affected me badly tiredface 	None
1138130167103205376	mtn yeah right the mtn mobile money being down has been quite an inconvenience hope it gets fixed soon 	None
1138216429424140288	mtn you guys why did disable the mm section on the now the app has no meaning to me at all help us please 	None
1138216572953223171	lotusuganda mtn you guys why did disable the mm section on the now the app has no meaning to me at all help us please 	None
1138350544714645504	mtn im fed up with your spam messages and have no idea how to stop themnkoooooye 	None
1138355742564638720	mtn it should not be a promotion be like airtel 	Negative
1138375825315835904	mtn your internet is not working but somehow my data is getting depleted may i please talk to whomever is in charge of feeding the gonya i know its almost lunch time but come on 	None
1138460811301675009	mtn thanks very much 	Positive
1138499625822932992	mtn thanks for the mbs 	None
1138529565846974466	mtn uhmmmm yesterday i came some of ur workers told me to go back and get police letter an went home mad at u coz i used my ka transport to come in town at shopright 	None
1138542897358229504	mtn mugisha same here i am having the same network error subscribed for a month pulsers offer 	None
1140134758611128320	dear mtn the week you promised to refund my money from the failed my pakalast activation has passed for how longer should i wait for my shs thanks 	None
1140159945054314497	hello mtn is the internet weekly bonus selective i subscribed to the weekly bundle hoping to get the bonus only to be greeted this morning that ive consumed of the bundle i need some explanation since i made years last month as your loyal customer 	None
1140166136622931969	this mtn bonus data move though fire 	None
1140262067800301569	i just want to thank mtn wish your internet was as good as your mobile money for enabling us to enjoy tidal i came for prince music and stayed for this 	None
1140271803123818497	mtn but please work on the quality of our internet it is very slowpoor dont let us into temptation 	None
1140275984345772032	would you rather spend k on mtnugs gb monthly bundle and get bonus to stream matches or subscribe for pay tv 	None
1140285258409107456	malowbar mtn the problem my mtn network is poor where i am but that offer is a good one 	None
1140295288428650496	malowbar mtn cry i put my mbs at right now i have mbs i am done cry i wasnt on youtube not even insta just twitter and whatsapp 	None
1140298943982723072	mtn its okay me i still love you its not like you will give me free data 	Positive
1140334511001092098	mtn this time im not complaining hope data will also be reviewed soon applause now i see value for money 	Positive
1140347727680872449	mtn i am seriously complaining about you mtn how comes that my number doesnt get mbs when i buy my pakapaka bundles should i abandon 	None
1140349568934207488	mtn lately am so bored with yo ka system 	Negative
1140349792561827840	most reliable network in uganda mtn 	Positive
1140507701375623168	mtn but why is that your internet bangs a lot of data 	None
1140510631654776833	am sorry mtn i moved on to airtel already rofl 	Negative
1140514690612772864	gadrogers mtn real deal clap 	Positive
1140515674038636547	but mtn why dont u just leave me to be a good customer without asking me to get a loan i dont want please stop the loan messages but money gifts are ok thank u 	None
1140517482387726336	mtn has today slashed mobile money sending fees by more than half a month after the telco hiked the fees 	None
1140530568318337030	sending money just got easier and better only with mtn check out the rates 	None
1140538657729916930	mtn thanks for this but also reduce on the withdrawal fee its too much 	None
1140560401496772608	any particular reason why ive failed to transfer money from mobile money to my account for like a week now its frustrating mtn barclaysuganda 	None
1140572427644211207	balambob mtn try sending to my number it should be working rofl 	None
1140580154047180800	mtn tells us to fall in love with the internet but with the way you can even watch a small twitter video love is patient must be in the tampcs 	None
1140581009169309696	rggoobi mtn but they just increased withdrawal charges exorbitantly with notice i think it affects us more the muntu wawansi 	None
1140591889978134528	with mtn l can now send mobile money to my loved ones and other business translations at half price awesome offer 	None
1140593231874445313	mtn thank you mtn uganda 	Positive
1140617970324004864	ugaman mtn internet is the best its fast and reliable and lasts longer i have tried monthly packages for africell airtel and mtn and mtn was the best 	None
1140630857218232320	mtn mtnugcare does your international customer support line work no one has picked my calls for the last two working days i am still an existing customer who needs support can i get the help from here if thats better 	None
1140633311309717504	mtn whats wrong with the mobile money app it hasnt been working for me for weeks or so 	None
1140634114464333825	i wonder how these sim cards are registered until now complaining to mtn even makes it worse 	None
1140703120420409344	mtn i think i should even start putting on mtn as part of my attire coz when it comes to communication its mtn that comes first even data i slay like i own it pulse thumbsup 	Positive
1140725695909380096	mtn am addicted to mtn services thank you for this another exciting episode 	Positive
1140815680167645185	mtn but you increased your withdrawal charges but some of us have not found it out eeeeeee be like airtel 	None
1140824598612721664	nelastojohn mtn u dont have to beg many other better cheap options are available at d neighborhood i moved on 	Negative
1140852413534003205	good mng team mtn the internet speed since yesterday is terrible 	None
1140877498303078401	thank you mtn for this it will boost my business and my fellow many who use mtn in our daily transactions we say thank you again for not only offering good services but also developing our telecommunications industry long live mtn 	Positive
1140880152735420416	amazing offers by mtn sending fees are at below half price my mother in the village can now get value for money afwoyo 	None
1140889032676843520	you can have gbs of data in this city but try to watch a small video on twitter and it will take you close to minutes to finish because mtn internet isnt it 	None
1140891388709691392	as for mtn i will always be your loyal supporter thank you for reducing the rates dancer mandancing 	Positive
1140903093632208896	mtn thank you for maintaining high standards of service delivery 	Positive
1140915383119036416	if not the best we have a good internet access in uganda as compared to other countries within the subregion however telecos can still do something about the cost to encourage more people to streaming their favorite songs and videos mtn mdundomusicug 	None
1140929205137551361	wimmtnug mtn good initiative they will be more transactions in rural area now work on urban areas for data bundle which you have recently shutdown completely 	None
1140930511264735232	mtn sim isnt registering all i see is a blank no network bars nothing my phone isnt registering it at all 	None
1140936145871749120	as mtn should also be investigated a few weeks ago this guys cheated us on my pakapaka bundles those who subscribed didnt get the mbs but the money was taken 	None
1140963893000495109	mtn its still showing invalid sim 	None
1140978101196865536	sincere appreciation of your continued hand of giving back to your loyal customersmtnug 	None
1140981728883834880	mtn why is it that ure giving me less mins for bigger amount on mtn voice bandle 	None
1140999168154120198	dear mtn if this is how you handle your lovely customers i would like to apologize in advance for my current debt 	None
1141040492584611840	airtel and thanks for the network speeds in adjumani and areas around east nile collision no other isp comes close raisedhands least of all mtn still on gsm angry cry 	None
1141071015893708800	dear mtn your network in nansana is poor these days i dont know why may be you know better 	None
1141091832170012673	mtn bonkers my line has been off for two weeks without service and u doing nothing pout 	None
1141134271282855936	kale i changed from airtel internet to mtn internet thinking bayina worknaye mbwa bubwamtnug u have the slowest network pout 	Positive
1141253481149468672	mtn your internet is down i cant even attach a simple file wth is going on 	Negative
1141255328438325248	everything about mtn is so annoying eeeh 	None
1141291236353085446	ssojo mtn failed to buy a sim card at mtn rwanda because i didnt have my ugandan passport had travelled with id only 	None
1141299612743086082	ssojo mtn imagine being there for days and use two days running after a simcard 	None
1141299683119288321	ssojo mtn imagine being there for days and use two days running after a simcard 	None
1141304697866915841	sebsronnie mtn i just need to know what ucc guys smoke 	None
1141307016700411905	mtn your internet speed today raisedhands just downloading a s voice note and it takes forever smirk 	Negative
1141364399787184128	mtn dassit whats the catch thoughhopefully it isnt one of those swift bundles that vanishes like surgical spirit 	Negative
1141403800823115776	mtn meu airtime option keeps returning system busy try again later kindly resolve 	None
1141406363144335360	gadrogers mtn i had gb but been downloading the whole of today now i have to spare use my balance 	Negative
1141409119942979585	mtn sim card registration failed 	None
1141413516844421120	mtn whats wrong with my tidal or your network i paid for my subscription but they keep sending me that thingi called you and a certain guy told me i uninstall it and install it again but it never helpedwakanda sht is this bambi 	None
1141431445606608896	mtn kindly fix ur network upcountry kisoro mtn this on and off is not cool 	None
1141619370017378309	socialoutcast mtn joy they reduced sending fee of mobile money joy 	None
1141625321273401344	mtn this would be good if that internet had some speed in it 	Negative
1141652863598379009	ugequitybank i am a bit disappointed i sent a simple ugx from my equity bank account to my phone on however your office sent in a message to mtn to block my line due to fraud i have not been informed of this from any official of yours and its absurd 	None
1141655685131845632	banange mtn what is happening with your network these days the network is too weak en poor we buy data until it expires if i may ask is it happening only in eastern side or mtn 	None
1141662599534260224	this is broad daylight theft i havent done anything with the data except social media and that one download i normally use mbs from mtn for a whole day on social media how can gb just disappear please africell please pout 	Negative
1141676104601735168	lizmutesi mtn played my gb weeks agoupto today i havent seen a refund 	Negative
1141707467119845377	urbanbouy mtn joy better go for africell 	Negative
1141742978261823488	mtn what happened to mymtn app 	None
1141747492695891973	mtn my mbsis the system down 	Negative
1141760405628424192	mtn whats wrong connecting to vpn using your network takes forever but airtel is chap what aint you doing right dont advise me about paying ott because i wont 	None
1141770169276088321	mtn has always provided the fastest internet in the country 	Positive
1141793214728462337	so mtn i buy ott for once in a long time and i fail to access google twitter instagram youtube until i switch my vpn back on whats up with your internet kyoka my ott is for a week cry 	Negative
1141929508574040065	the way mtn swindles my data bundles requires a judicial ruling no just twitter and facebook mbs with in mins no mweddeko 	Negative
1141959734330908672	rakthoni mtn sincerest apologies for any inconveniences possibly caused we believe that we contacted you a while go and advised on the same all affected mtn numbers should be able to transact as of now in case of any other support were here to assist 	None
1142023335011921921	mtn i need my line on please mtn uganda i am making losses because of you 	None
1142069360867106816	mtn what is up with the mobile app am getting message that service is not available 	None
1142082990253568001	dear mtn im aware of the mocash loan i owe you and i promise to pay when my economy stabilizes for that case stop sending me scaring messages that youll blacklist me from taking the loan again joy 	None
1142132295832395777	benjamin mtn small small ka loan and they hound you as if you joined the network yesterday 	None
1142137333468344320	mtn what is wrong with your internet network lately are you just going to ignore all these complaints on the timeline lately 	Negative
1142143288880828418	mtn i have been away for time got back to check on my mtn simcard its not supported by my phone yet i registered it already any help 	None
1142169682486714369	benjamin mtn i took a loan of m tool long to pay one day i decide to pay the balance of k so as to get a bigger loan i failed only to be told i had been blacklisted 	None
1142540413179506689	mtn is there anything wrong with your internet its too damn slow 	Negative
1142541139200925701	mtn why didnt u tell us that wen u introduced the bonus on monthly bundles u also introduced a ka in there to quickly deplete it 	Negative
1142702889934249984	mtn what happened to mymtn app 	None
1142813442862211080	mtn is there a network error coz i cant get through 	None
1142860084483100673	mtn i cant buy data via mobile money wsup 	None
1142866050389827587	mtn my internet connection is too slowhow do i over come 	Negative
1142867437458722819	mtn so slow is your internetbut then within no time mukama abasasirethe earthquake that willhit your towers is still in the alps 	Negative
1142870140041801728	dear mtn i have no problem with your data packages but the issue is with the network yet am on a hill please do something 	Positive
1142878855696269312	thanks so much mtn 	None
1142955418647498752	mtn so still the mobile money section of the my mtn app is still down its over months is this normal expressionless 	None
1143046494557212673	good morning mtn mtnza how are you i have feedback on the quality of internet service provided by you to my work place it can be good bad and terrible this monday morning its terrible its moody some days are very good thank you so much yours faithfully customer 	Negative
