id	sentence	label
1094482757378551808	victoriamallug mtn dear mtn i bought this product and the number one problem is that one has to pay for ott daily in order to run all other social media apps this means i have to pay double tax i called customer service was given a reference and the issue hasnt been resolved 	None
1094509024865853441	mtn your customer care personel named ronald is rude and does not listen 	None
1094557074833502209	mtn my only problem is that you are using africell colors 	Negative
1094582840984064001	rasoug nze am about to run away from mtn 	Negative
1094588400760487936	mtn should also be serious you cant be in the market for over years and still provide such hopeless internet your internet speed is always ks all youre doing is update me that ive used if my bundle what am i doing minutes waiting for a page to load 	None
1094637267887550464	mtn you are a shameless lot 	Negative
1094642703864868864	mtn come on guys my internet connection has been on edge network from g for the past hourinternet is my businesscan work with this connectioncome on 	None
1094656748403769345	you know why i keep online all day hahaha just join now and enjoy mtn 	None
1094665441094578177	fk mtn internet being poor and the worst on a weekend and they will come our to convince ppo fake like their colour 	None
1094802665387773952	maama we made it fire notes rotatinglight raisedhands fire judewats mtn 	Positive
1094862878396596224	mtn what is wrong with your system balance ussd is dead i thought i had an active voice bundle but calls are hitting my airtime instead 	None
1094883071520923648	im trying to cope up with airtel horrible speedi was extremely tired of mtn robbery 	None
1094926940077805568	my pakapaka package makes things a lot simpler dial to activate mtn 	None
1094990031922622466	mtn experiencing this kampala heat as well your internet connectivity is suffering melting under the heat we can not conduct conference calls the connection has been dropping incessantly over the past two weeks what is the challenge when can we expect a resolution 	None
1095008556921835527	hey mtn can i please know why i cant access my momo account yet am an active agent 	None
1095061592029515778	mtn why do you put pressure on me am stressed by the way kindly do me a favour of any data bundle of your choice joy 	None
1095226088517763072	mtn you thieves i swear i will not buy any data bundle from you not now not even never frauds just leave our country nothing else you do here 	None
1095248214012383232	mtn your response hasnt been helpful check your dm again 	Positive
1095280079867990016	mtn pliz fix your network im trying to call people and my phone keeps saying not registered on network this has happened for the past week 	None
1095286327526993920	dear mtn i will not tolerate your robbery the way my data gets depleted this is unusual am considering resorting to any other network mtnugpro 	None
1095347063334883328	mtn has contributed ugx million to support rotaryuganda operationalize the mengo rotary blood bank under the initiative rotary uganda seeks raise usd towards purchasing equipment and a fully equipped mobile blood bank 	Positive
1095363921043697666	kccafc mtn as a kcca fan am happy with such technical and development ideas such discounts calls us note to support our team effectively thanks the management 	Positive
1095368696942481408	but mtn y do u punish people like this 	Negative
1095372026481647618	the way mtn is hogging data this evening scream 	None
1095429191611363328	mtn lets put some respekk on valentines please this gb gaaga is utterly disrespectful smirk 	None
1095461654337409024	mtn just loaded data but still doesnt connect 	None
1095533585585655808	mwe mtn wtf is this gaga valentine hogwash 	Negative
1095543808245284864	mtn i think this gaga wednesday thing should be disbanded form what you offer this aint interesting any more gb at k mbu valentines day is still open let me buy my paka bundles waiting for africell on friday and enjoy wave bye 	None
1095574746786418689	mtn i switched my phone to g and received gb but they are in active advise me please 	None
1095615064571293697	mtn gaga gb at ugx okay now i got to download ralph breaks the internet since its now available in hd via torrents sunglasses 	None
1095633418120060931	but mtn if you compare last years valentine gaga bundle to this years its embarrassing 	Negative
1095634033780891648	mtn i am not seeing the gb free you said we would get 	None
1095638678611869696	roketelkomug hey there do you guys have an mtn optionhow does one pay you minus incuring mobile money charges 	None
1095675106641276928	who told mtn that we wanted this bogus gaga valentine vuyos unamused 	Negative
1095682963570917378	mtn i didnt get the free gb though confused 	None
1095684340724523010	mtn i have really liked this offer 	Positive
1095700680680062977	mtn u mean joy putlitterinitsplace 	Positive
1095723016993075200	wabula we have suffered with mtn and their gaga please refund my money 	Negative
1095738133931573249	atimcharlotte thats mtn the offer is lame 	Negative
1095874564016488448	mtn buying an mtn valentines gaga bundle at k valid for days and its scrapped by morning is the biggest robbery i have ever got 	Negative
1095929776588681216	mtn please fix my tidal sob i need to be with my music 	Negative
1095935483299934208	mtn today announced that the season has raised ushs million to go towards the improvement of maternal health 	None
1095937601557663744	apparently mtn raised ushs million from the intended to improve maternal health 	None
1095939352134369281	stackss mtn experiencing the same problem too cry 	None
1095977481973256192	mtn i didnt get my free gb rolleyes 	Negative
1095977602538336256	rytahug mtn luckily this one runs until saturday in case you deplete the bandoz 	Negative
1096024701342834688	so mtn that had promised to reach out with its technical team to verify their claims on how my data was being consumed on service i personally dont access failed to respond to the details about the appointment 	Negative
1096028645750173696	mtn do i need to pay ott to surf the internet how come i cant access the internet with out me connecting through the vpn 	Negative
1096031191755571200	mtn my point is not social media am trying to use the internet for other stuff but can only access it through a vpn i thought ott was limited to social media do i need ott to use the internet for other things that are not social media 	Negative
1096036365068914688	enough about valentine mtn we are not your friends stop treating us as if we have shares how do you be eating my data in minutes you forced me do something i dnt do if this happens again am suing you 	Negative
1096037471761121281	iraguhaherbert mtn like i just bought my data mbu now you have used wtf 	Negative
1096037803866161157	iraguhaherbert mtn stupid mtn 	None
1096042436504231938	agasharebecca mtn airtel is giving gb on valentine in case u upgrade ur line to g so u can switch 	Negative
1096119570811768832	but why is my internet always slow between pm to pm cmon mtn thought we left that st in 	Negative
1096120549930078208	mtn i need to know what you decided to cheat me today 	None
1096122199910612999	mtn hullo cants call on my number yet i have credit why could this be 	None
1096146863697395712	excuse me mtn i dont understand what happened to the old way of loading ott i dont want data 	Negative
1096253688249753601	sabitijoseph mtn i dont think its still the leading service provider here 	None
1096276752312225793	denzelug i cant wait for he fake services to come from mtn after all these changes its been good for me surely 	None
1096286160215785472	mtn was spending some good money to make air time scratch cardswith the removal of the scratch card and the introduction and wide promotion of easy load system i expected some good calls and internet data discounts but just like entebbe taxi they just kept it up there 	Negative
1096290509763604480	jokes aside mtn has the fastest internet in uganda kati why not buy your self a gb and get gb for free to share with your lover to gift the free gb to ones loved one will dial after buying your bundle and follow the steps to share the free bundle 	Positive
1096293122194227200	compromising national security is putting the entire nation at stake ugandans deserve better from you people that are planning to cause meyhem i request mtn to respect the business environment and favourable policies for investment here in the country 	None
1096300004443066369	with this situation of deportation of mtn officialsmy mobile money is not safethoughts 	None
1096302865344278530	mtn mtngroup they deport the ceo and network goes down early morning style guys 	None
1096307140615176194	centenarybank mtn thank you so much 	None
1096320325413941249	has the successful bosco mobile money campaign become a cancer mtn this security thing does not add up for me 	None
1096327720823390208	what went wrong mtn it looks like everything has been going well until they brought on board the bosco advert 	None
1096328257119678464	mtn whats up with the mobile money service unable to send 	None
1096333506442117125	whats happening to the yellow telecommunications house hope the deportations dont affect their services mtn 	None
1096335700520243200	mtngroup mtn not surprised not by the way mtn refuses to adress fraud 	None
1096346748870627329	mtn mtngroup stop being used by countries to fight other countries just do your work you are a telecom company not a rebel group goodluck going forward 	None
1096349973644537857	justgystin mtn the service may also have been deported at this rate 	None
1096353113898995712	mtn mtngroup i hate to see such big company getting involved in politics come do business and leave why would you want to topple a govt stupid selfish interests first you take all the profits pay yo uganda employees nothing may god reward u 	None
1096377101471703040	mtn how long does the gb last 	Negative
1096377611805167616	mtn is this the gb gaga offer that expires saturday morning 	Negative
1096383766703104005	mtn mtngroup ur services are to expensive thats why 	None
1096439597813374976	that time mtn was withholding peoples monies send to wrong recipients or erroneously sent in billions and governments uccofficial was watching we made noise and till now the matter was never resolved just went asleep but i am glad we are vindicated 	None
1096445905270657024	mtn gb k why dont you go to die my pakapaka gb 	Negative
1096476529532522503	mtn pliz mtn ur internet is very slow pliz work on it its not me or internet users who deported ur ceo wem 	Negative
1096478481167331329	mtn years of cheating ugandans using impunity connivance and suffocating newcomers in telecom industry 	None
1096514650903101442	mtn thanks to mtn 	None
1096519249303126019	dear mtn kindly sort the issue of missed call alerts when phone batteries go off thank u 	None
1096686707234258944	mtn we celebrate your u today 	None
1096714327053209600	mtn thats my point mtn why a minute hushed in this generation of internet min sec is not equal to minutes i hope u consider charging in real time thx royal customer for yrs 	Negative
1096741403940524033	mtn if you have failed to handle issues than let us customers take a fore front 	None
1096819236595474432	mtn mweterezee i have not received my mbs for the deportation of ceo hugs 	Negative
1097082043165536257	mtn you guys i already have an existing data bundle why must i buy another bundle in order for me to share it 	None
1097194786677817344	henryshaykins joy not really mtn has been delivering a great service over the years they will get through this phase we all just need to learn from their experience they will overcome 	None
1097203027054874624	mtn internet is trashier bring back those foreigners sob 	None
1097304540951597056	mtn hello slow network in namugongo what could be the problemno lte at all 	None
1097398984304455680	mtn explain this to me my data connection was off and still u chopped my ka bundle from to in one minute sob just because am a munyankole doesnt mean am the one who is deporting yo fellas 	None
1097405055098109952	i dont think mtn was ready for this tidal app thing for months theyve been trying to rectify an issue for me till now 	None
1097447813816991744	mtn and then boom u start loosing airtime even in ur sleep 	None
1097483557918990336	airtel ive for long complained amp made it clear that i do not want your useless msgs but uve stubonly refused to comply i did the same with mtn but how come they stopped amp for u say i can stop receiving them to eat up my space thx for that 	None
1097520224507740160	when it comes to datai have never seen a thug like mtn 	None
1097592204783161344	igumirab mtn thanks for representing us joy 	None
1097730499089440768	uccofficial we continuously are cheated by mtn on minutes usedi have been a victim on voice bundles for so long please investigate the duration of calls 	Negative
1097758265683918848	mtn please always do the math correctly because of gb can not be you confuse us 	None
1097820451756224512	mtn i lost my line and today filled the due process and up till now am yet to access the networki have restarted my phone severally but nothing has changedi have inboxed the number 	None
1097854051771916290	mtn plz management of mtn ugyour network signal is completely weak sometimes not there in new district of kapelebyong please check it out and help the community thanks 	None
1097859948967530498	mtn currently i travelled out of the place that why u see am on and sending u this msg but it has lasted for long more than month but people have no choice pls do more survey 	None
1097861688932663296	no more excuses of missing out on your fav tv shows because you aint at home mtn gat you sorted 	None
1097899191475585026	mtn jst stole my airtime joycat 	None
1097900740432007169	mtn gim me my airtime back 	None
1097938569325350913	mtn having trouble completing a transaction online actually here on twitter ads 	None
1097939576197390336	mtn it says card declined and it cant charge my funding source momocard 	None
1097977119932583936	mtnugcare mtn i guess the my mtn app kibulamu it cant buy my pakapaka it only functions online kibulamu 	None
1098130264071565318	mtn why do i have to pay ugx to access a ministatement for my mobile money transactions 	None
1098137997525028864	sabalwanyi we call it monthly subscriptionswe keep making noise about mtn cheating ugandans on mbs and call data but these womens bills come like ejaculations 	Negative
1098141833635479554	mtn why is your network so slow 	None
1098158480127680514	airtel freaky friday feels like a week away sob this wednesday gaga is a total joke 	Negative
1098185513222189056	these mtn people have become a joke this gaga offer should be dropped 	None
1098187680544903169	mtn i am in kampala it keeps changing btw h and g 	None
1098245082585673728	mtn this is hogwash putlitterinitsplace download an app load mobile money blah for gb just do away with it we shall use airtime 	None
1098248167722811392	mtn agreed the app is handy cant say the same for that bundle putlitterinitsplace 	None
1098299163039682560	idk whats happening with the mtn network but lately making a call is too much work network is so shitty you spend half the call duration asking the other party if they can hear you or not such a shame 	Negative
1098322228775714816	mtn please help me i got my mtn mobile money line agent on but up to now it never changed its profileviola and danson enterprises ihv gone to mbarara service centre but all in vainthey told me line was counselled my phone no 	None
1098460895716560896	mtn please stop this nonsense where one wants to withdraw savings from mokash and it shows unfortunately it cant proceed with the transaction at this time you can never know when someone is in emergency to need his savings stop rolling out unstable services stop 	None
1098538197146058753	mtn your agents are making our lives difficult they have no float on their phones so painful and annoying pout 	None
1098794360752275456	pyeparfaisal mtn twitter customer care team never allows me to have a second sip of ma drink without followup dm instantly its kind like we are at the same table having a live chat raisedhands 	None
1098822260285153280	babsdorothy mtn guys are doing a dirty on this one been complaining since cz i think they forget that these days we can track these things easily phones show call lengths and all so if i used only mins yet some how have gone of course ill notice 	None
1098857590187020289	dear mtn this is the last week i am using your internet cz i already paid for it it has been trash i have complained and sent screen shots and called customer care and now i am fed up u cant take mins to watch a min video mins to download a mb pdf 	None
1098867940290711552	these jokes mtn should stop so i tried subscribing for internet and you deducted my money then after you inform me how you have a temporary failure like it has just been realized thinking 	None
1098886213250043904	thank you mtn hugs 	None
1099005006961934336	currently in nairobi mtn however i can not recieve any calls yet i can make calls to safaricom and mtn airtel ug 	None
1099022947774271508	mtn please the way your chopping our data is beyond normality please try to adjust 	None
1099120472325804032	mtn why cant i access the mobile money services since yesterday is there a problem 	None
1099127854925778947	mtn those gaga bundles actually just make one to uninstall the mymtn app 	None
1099192770458198016	whats up with mtn when you call their helpline they always are regret the inconvenience caused about something really couldnt mtn work on a more technicalglitchfree approach 	None
1099226607275962368	bashk rolleyes eeh i thought it was only my mtn misbehaving kumbe 	None
1099368249039437827	mtn its faster and fastest when i load less than mb but gb its just faster than a tortoise 	None
1099397053174738944	just making use of mtn g in kisoro before the hike tomorrow 	Positive
1099538135908798464	mtn guys we cant load data more than mbs 	None
1099550484032090112	what is wrong with mtn this morning they are taking my money not giving me services they customer lines are busy is it still worth trusting am so disappointed 	None
1099552208310411264	mtn data lostpaka paka data using mm just keeps chewing my money without giving me my dataohh gosh 	None
1099552637375209472	is it my phone or something wrong because the mtn yange thing deducts money from my mm and i end up not getting the mbz mtn 	None
1099553828813312000	mtn mwetereeze i requested for my pakapaka bundle at but you didnt give e me my free minutes and your customer care number is busy all the time waiting for feedback 	None
1099554225405730817	mtn i have been patient but its really taking longer and am losing out on what i wanted to do 	None
1099559287146328064	mtn hours am still waiting for calls to be initiated or i first wait for more ceos to be deported pout 	None
1099564908918788098	mtn why is the ott tax service unavailable 	None
1099608711268585472	i loaded paka mbs and while the money was deducted i did not get my bundles when i called i got to know that there was a problem so shall my bundles be creditedmtnug 	None
1099626617670942720	so for voice is off i wonder if mtn will give us the minutes weve paid for and couldnt recieve them when we needed them i have had issues before where my data wasnt given to me after resolving data issues 	None
1099634089945190400	whereever is incharge of tapping calls for mtn is doing a crappy job dropping calls we can hear you breathing even before the call connects or is picked if you want to tap do a better job 	None
1099685724817948672	mtn please fix your internet g network in najjera its very annoying especially in this era of fast internet network 	None
1099691933604163584	mtn how come out data is disappearing so fast us customers had nothing to do with the deportations 	None
1099700899973394433	mtn this morning i lorded air time and subscribed for your but havent received my minutes 	None
1099702362237820928	mtn whats wrong with your internet service today i dont know if i am the only one 	None
1099743936384589824	ive so had enough of mtn yeeerrrr your internet is slow maarn 	None
1100972900008542208	umemeltd mtn the issue was solved thank you 	None
1100973279219773441	mtn data thuggery is back again it aint normal uccofficial 	None
1101140426805993473	mtn you will always remain the best 	None
1101174925132550145	mtn this is the message that phone brings and you are there bragging that your system is working style up 	None
1101205644869292032	edwinejnr edwin mtn is my father mother son friend and my provider always i had my first smartphone from mtn 	None
1101400792404234240	mtn tweet help made an mm transaction but got no transaction id your quick response will be highly appreciated 	None
1101437032679776257	mtn thanks mtngreat job 	None
1101467271745208320	mtn airtel your mobile money systems for the agents should also ask for the senders phone number so the sender can be notified of successful money send at the moment unless i call the recipient i leave the counter with a weird feeling of uncertainty feel me 	None
1101480954797932545	mtn thank you mtn satisfied 	None
1101507058409635840	mtn please convince me that you have some amazing data plans because the urge to cross over to the red corner is getting overwhelming that gb for k going for days and their freaky friday biashara has me side eying them all day ball is in your court now 	None
1101591485441548288	mtn voice calls are the worst most times network is and internet is at edge of the time i literally have to move about to look for signalstrength 	Negative
1101725812812849152	i dont know what uganda did to deserve services as good and efficient as mtnugs you guys are the best thank you 	None
1101856013320376325	am in but am fully enjoying mtnugs network as if am around bugolobi satisfied kyokka the one seated next to me is fighting with his g 	None
1101900165248679936	have been trying to buy yaka since pm this afternoon mtn and umemeltd seriously can we ever get a reliable system service eeeeiiiieee 	None
1101900901411942400	mtn thank you so much 	None
1101900901625880576	mtn thank you so much 	None
1101902115696492545	mtn hi guys is your mobile payments system down been battling to pay for dstvuganda with no success 	None
1101905328629792769	mtn i sent money using a mm agent it was received but later disappeared it doesnt even reflect on the mini statement how can i be helped regards 	None
1101931604988051457	mtn thanks mtn for the feedback its all good now ive managed to purchase the yaka 	None
1101935184415461377	ksheebah rocking kabale people mtn thanks for fulfilling the promise it was fire 	None
1101950224749211648	this is not fair mtn nt even opening my apps this is so unfair you have decided to treat me the way airtel did let me try other networks i see 	None
1102094302270894081	i would like to thank uccofficial and mtn for having coverage in the most rural of places openhands you have saved many city raised folks 	Positive
1102423677608562688	mtn why cant i make phone calls its now two days 	None
1102545333308084225	its been two weeks now since mtn blocked my mm account alleging that i received money wrongly i explained to them that i expected this money and so had rightly been paid by organization x the org wrote to them confirming this but my account is still blocked up to now pout 	None
1102546269757677569	i have money stuck on this account i have written to mtn several times but i dont know why they have ignored my cry i thought this impunity had stopped with bkabumbas but as it appears they never stop pout 	None
1102784600202506245	mtn i have never subscribed to mokash auto savingsyou chopped my money in the nighti need it back 	None
1102854176357400576	boda in regards to mtn ive been able to effectively communicateamp network with my clients this has boosted salesampincreases audience awareness of the producethis hustle has equipped me with skills firstamp foremosthelped me to acquire self dependence as well 	None
1102863166067871744	mtn safeboda for sure with mtn pulse has helped me to have enough data to call up the safe boda 	None
1102877911948906497	this mtn g is a lie the thing is so slow its even worse than the g ehhh chisos 	None
1102890430558031874	mussly mtn airtel g is worse 	None
1103012428336517121	hello mtn i thank because even if my bundle has expired i cant still use safeboda app without data because of that am never late for work and lectures 	None
1103023789107929089	mtn good evening my fellow ugandan i need urgent answers to these puzzles i have been a customer on this network for years i even do not but to my surprise we the old clients are treated with disgrace when it comes to data usage the new numbers are having an upper 	None
1103159469230436354	and yet with mtn superfast g internet here the entire parliament can view a live video presentation in hd from the manufacturers or would they rather physically inspect kickkick the tyres to check whether the pressure is right et cetera 	None
1103169468321185792	mtn do better thanks 	None
1103187304594767873	mtn which number is this that always wants to cheat me everytime am buying data or ott using the app for my self i get the notification to pay to and i cancel can u pliz rectify that issue 	None
1103199320717869057	georginanaluzze mtn well done amp keep winning maam clap 	None
1103235118280396801	for whichever hustle you are into gb of mtn data and k safeboda credit can be such a boast is ladies take some time and talk about your gig hustle and work lets more reason to celebrate its more pointdown 	None
